"Cyberpunk Guanyin, neon halo, quantum compassion circuits, neo-Shanghai skyline, art by Ilya Kuvshinov and Zaha Hadid, unreal engine 5, 8k, cinematic, (digital transcendence:1.3), iridescent bubbles, sacred geometry background"
"Afrofuturist Valkyrie, vibranium wings, plasma spear, Wakandan Valhalla, by Kehinde Wiley and Syd Mead, hyper-detailed exoskeleton, dramatic god rays, low angle, 8k sharp focus, (mythic technology:1.4)"
"Biomechanical Kitsune, chrome tails, holographic illusions, nanotech Inari shrine, style of Masamune Shirow meets Hokusai, intricate details, matte painting, soft illumination, (folkloric cybernetics:1.5)"
"Steampunk Lunar New Year Dragon, brass scales, steam-powered joints, Victorian Chinatown, art by James Gilleard and Bruegel, ink splatter technique, alcohol ink effects, (anachronistic celebration:1.3), red and gold accents"
"Quantum Shaman, probability cloud headdress, entangled spirit animals, 5D ayahuasca vision, by Alex Grey and Zdzis?aw Beksi?ski, fractal patterns, intense lighting, partly silhouette effect, (psychedelic realism:1.4)"
"Hydropunk Cleopatra, water-bending braids, bioluminescent makeup, submerged Alexandria, concept art by Artgerm and Craig Mullins, synthwave colors, underwater lighting, (aquatic royalty:1.5)"
"Nanotech Geisha, shapeshifting kimono, data-infused kanzashi, neo-Tokyo teahouse, style of Yayoi Kusama meets Blade Runner, pixelated cherry blossoms, neon calligraphy, (digital tradition:1.3)"
"Chrono-Viking, temporal axe, era-shifting longship, anachronistic Valhalla, art by Simon St?lenhag and Frank Frazetta, rusted futurism, northern lights effect, (warrior out of time:1.4)"
"Biopunk Medusa, gene-spliced snakes, CRISPR gaze, post-human Greek ruins, by H.R. Giger and Gustav Klimt, organic tech fusion, petrified circuit patterns, (mythological evolution:1.5)"
"Quantum Samurai, probability blade, superposition armor, 5D Edo period, style of Yoshitaka Amano and M.C. Escher, impossible geometry, ink wash techniques, (reality-splitting warrior:1.3)"
"Cybernetic Frida Kahlo, neuro-linked flower crown, data-driven surrealism, Mexico City 2099, art by Jean-Michel Basquiat and Frida Kahlo, vibrant glitch effects, AI-generated fauna, (identity in the machine:1.4)"
"Astro-Nautch Girl, zero-G sari, stardust bindi, orbital Taj Mahal, by Raj Kamal Jha and Chris Foss, cosmic rangoli patterns, nebula backdrop, (dancing across galaxies:1.5)"
"Neon Noir Detective, holographic fedora, quantum intuition, multi-dimensional crime scene, style of Blade Runner meets Edward Hopper, rain-slicked neon reflections, volumetric fog, (future gumshoe:1.3)"
"Mecha-Centaur, fusion cannon haunches, targeting optics, neo-mythic battlefield, art by Hajime Sorayama and Boris Vallejo, chrome musculature, dynamic action pose, (hybrid warfare:1.4)"
"Quantum Ronin, probability wave katana, Schrodinger's armor, feudal quantum realm, by Yoji Shinkawa and Salvador Dali, melting reality, cherry blossom data streams, (digital bushido:1.5)"
"Cyborg Pharaoh, solar-powered crown, nanoscale hieroglyphs, terraformed Mars pyramid, style of Josan Gonzalez and Lawrence Alma-Tadema, rusty sci-fi aesthetics, holographic afterlife, (ancient future ruler:1.3)"
"Bioluminescent Siren, gene-spliced fins, hypnotic bio-songs, deep sea neon jungle, art by James Jean and Ernst Haeckel, organic fractals, abyssal pressure distortions, (evolutionary enchantment:1.4)"
"Steampunk Shiva, clockwork arms, steam-powered third eye, Victorian Cosmos, by John Blanche and Zdzis?aw Beksi?ski, brass mandalas, cosmic gear mechanisms, (industrial divinity:1.5)"
"Nanotech Valkyrie, swarm-wing construct, quantum spear, Yggdrasil space station, style of Beksinski meets Syd Mead, ethereal tech-organic fusion, aurora borealis energy fields, (transcendent chooser:1.3)"
"Chronoshift Geisha, temporal kimono patterns, era-jumping tea ceremony, anachronistic Kyoto, art by Makoto Shinkai and Alphonse Mucha, time-layered landscapes, quantum cherry blossoms, (elegance across ages:1.4)"
"Cyberpunk Guanyin, neon halo, quantum compassion circuits, neo-Shanghai skyline, art by Ilya Kuvshinov and Zaha Hadid, unreal engine 5, 8k, cinematic, (digital transcendence:1.3), iridescent bubbles, sacred geometry background"
"Afrofuturist Valkyrie, vibranium wings, plasma spear, Wakandan Valhalla, by Kehinde Wiley and Syd Mead, hyper-detailed exoskeleton, dramatic god rays, low angle, 8k sharp focus, (mythic technology:1.4)"
"Biomechanical Kitsune, chrome tails, holographic illusions, nanotech Inari shrine, style of Masamune Shirow meets Hokusai, intricate details, matte painting, soft illumination, (folkloric cybernetics:1.5)"
"Steampunk Lunar New Year Dragon, brass scales, steam-powered joints, Victorian Chinatown, art by James Gilleard and Bruegel, ink splatter technique, alcohol ink effects, (anachronistic celebration:1.3), red and gold accents"
"Quantum Shaman, probability cloud headdress, entangled spirit animals, 5D ayahuasca vision, by Alex Grey and Zdzis?aw Beksi?ski, fractal patterns, intense lighting, partly silhouette effect, (psychedelic realism:1.4)"
"Hydropunk Cleopatra, water-bending braids, bioluminescent makeup, submerged Alexandria, concept art by Artgerm and Craig Mullins, synthwave colors, underwater lighting, (aquatic royalty:1.5)"
"Nanotech Geisha, shapeshifting kimono, data-infused kanzashi, neo-Tokyo teahouse, style of Yayoi Kusama meets Blade Runner, pixelated cherry blossoms, neon calligraphy, (digital tradition:1.3)"
"Chrono-Viking, temporal axe, era-shifting longship, anachronistic Valhalla, art by Simon St?lenhag and Frank Frazetta, rusted futurism, northern lights effect, (warrior out of time:1.4)"
"Biopunk Medusa, gene-spliced snakes, CRISPR gaze, post-human Greek ruins, by H.R. Giger and Gustav Klimt, organic tech fusion, petrified circuit patterns, (mythological evolution:1.5)"
"Quantum Samurai, probability blade, superposition armor, 5D Edo period, style of Yoshitaka Amano and M.C. Escher, impossible geometry, ink wash techniques, (reality-splitting warrior:1.3)"
"Cybernetic Frida Kahlo, neuro-linked flower crown, data-driven surrealism, Mexico City 2099, art by Jean-Michel Basquiat and Frida Kahlo, vibrant glitch effects, AI-generated fauna, (identity in the machine:1.4)"
"Astro-Nautch Girl, zero-G sari, stardust bindi, orbital Taj Mahal, by Raj Kamal Jha and Chris Foss, cosmic rangoli patterns, nebula backdrop, (dancing across galaxies:1.5)"
"Neon Noir Detective, holographic fedora, quantum intuition, multi-dimensional crime scene, style of Blade Runner meets Edward Hopper, rain-slicked neon reflections, volumetric fog, (future gumshoe:1.3)"
"Mecha-Centaur, fusion cannon haunches, targeting optics, neo-mythic battlefield, art by Hajime Sorayama and Boris Vallejo, chrome musculature, dynamic action pose, (hybrid warfare:1.4)"
"Quantum Ronin, probability wave katana, Schrodinger's armor, feudal quantum realm, by Yoji Shinkawa and Salvador Dali, melting reality, cherry blossom data streams, (digital bushido:1.5)"
"Cyborg Pharaoh, solar-powered crown, nanoscale hieroglyphs, terraformed Mars pyramid, style of Josan Gonzalez and Lawrence Alma-Tadema, rusty sci-fi aesthetics, holographic afterlife, (ancient future ruler:1.3)"
"Bioluminescent Siren, gene-spliced fins, hypnotic bio-songs, deep sea neon jungle, art by James Jean and Ernst Haeckel, organic fractals, abyssal pressure distortions, (evolutionary enchantment:1.4)"
"Steampunk Shiva, clockwork arms, steam-powered third eye, Victorian Cosmos, by John Blanche and Zdzis?aw Beksi?ski, brass mandalas, cosmic gear mechanisms, (industrial divinity:1.5)"
"Nanotech Valkyrie, swarm-wing construct, quantum spear, Yggdrasil space station, style of Beksinski meets Syd Mead, ethereal tech-organic fusion, aurora borealis energy fields, (transcendent chooser:1.3)"
"Chronoshift Geisha, temporal kimono patterns, era-jumping tea ceremony, anachronistic Kyoto, art by Makoto Shinkai and Alphonse Mucha, time-layered landscapes, quantum cherry blossoms, (elegance across ages:1.4)"
"Biopunk geisha, nanotech kimono, DNA-infused makeup, cherry blossom neuralnet, in style of Masamune Shirow meets Frida Kahlo, hyperdetailed, Hasselblad X1D-50c, 90mm f/2.2, Cinestill 800T, (ethereal beauty:1.3), dark moody atmosphere"
"Quantum samurai, probability wave katana, Schrodinger's armor, feudal Japan meets CERN, artwork by Yoji Shinkawa and M.C. Escher, ultra high res, Sony A1, 35mm f/1.4 GM, Kodak Ektar 100, (reality-bending:1.4)"
"Steampunk Cthulhu cultist, brass tentacle mask, clockwork grimoire, Victorian London skyline, art by H.R. Giger and John Blanche, analog film grain, Leica M10 Monochrom, 50mm Noctilux f/0.95, Ilford Delta 3200, (eldritch horror:1.5)"
"Cybernetic valkyrie, neon wings, plasma spear, Valhalla space station, in style of Syd Mead meets Frank Frazetta, 8K UHD, RED V-Raptor, Panavision G-Series anamorphic, IMAX 70mm, (mythic futurism:1.3)"
"Post-apocalyptic ronin, nanoblade katana, rad-suit kimono, Neo-Tokyo ruins, art by Katsuhiro Otomo and Simon St?lenhag, cinematic, ARRI Alexa 65, Hawk 65 Anamorphic, Kodak Vision3 500T, (desolate beauty:1.4)"
"Afrofuturist griot, holographic kora, quantum griotte patterns, Wakanda cityscape, by Jean-Michel Basquiat and Kehinde Wiley, vibrant colors, Canon R5, RF 28-70mm f/2L, CineStill 800T, (cultural resonance:1.5)"
"Nanotech dryad, circuit leaf skin, fiber optic roots, data forest, artwork by Alphonse Mucha and Android Jones, ultra detailed, Phase One XT, 150mm Blue Ring, Fujifilm Provia 100F, (digital nature:1.3)"
"Chronoshift DJ, time-warping turntables, temporal mixing board, multiversal rave, in style of Beeple meets Salvador Dali, surrealistic, Nikon Z9, 14-24mm f/2.8 S, Lomochrome Purple, (rhythmic distortion:1.4)"
"Mecha-kitsune, plasma tails, quantum illusion circuits, shinto cybershrine, art by Hayao Miyazaki and Tsutomu Nihei, studio ghibli aesthetics, Fujifilm GFX 100S, GF 110mm f/2, Velvia 50, (mythic technology:1.5)"
"Psyborg shaman, neural lace headdress, ayahuasca nanites, digital spirit realm, by Alex Grey and H.R. Giger, psychedelic realism, Sony Venice 2, Leitz THALIA, 16K resolution, (transcendent vibration:1.3)"
"Quantum origami artist, probability paper, spacetime folds, 4D exhibition space, artwork by M.C. Escher and Makoto Shinkai, hyper-realistic, Hasselblad H6D-400c, 120mm macro, Acros 100 II, (dimensional complexity:1.4)"
"Cyberpunk onna-bugeisha, monofilament naginata, augmented reality makeup, neo-feudal megacity, in style of Masamune Shirow meets Hokusai, detailed linework, Canon EOS R3, RF 85mm f/1.2L, Portra 400, (neo-traditional:1.5)"
"Holographic tea master, light construct chawan, quantum matcha, Zen 3.0 garden, art by teamLab and Hiroshi Sugimoto, minimalist, Leica SL2, APO-Summicron 75mm, Ektachrome E100, (serene technology:1.3)"
"Nanoforge blacksmith, plasma hammer, quantum anvil, orbital forge station, by Ian McQue and Greg Rutkowski, industrial fantasy, RED Komodo 6K, Tokina Vista 40mm T1.5, Kodak 250D, (cosmic craft:1.4)"
"Bioluminescent geisha, algae kimono, photonic kanzashi, deep sea teahouse, artwork by James Jean and Ernst Haeckel, organic art nouveau, Nikon D850, 105mm f/2.8 VR macro, Cinestill 800T, (abyssal elegance:1.5)"
"Chrono-ninja, temporal shuriken, paradox smoke bombs, feudal time war, in style of Yoshitaka Amano meets Salvador Dali, surreal ukiyo-e, Fujifilm X-T4, XF 56mm f/1.2, Lomography Color Negative 400, (historical distortion:1.3)"
"Quantum kabuki actor, superposition mask, entangled stage, parallel world theater, art by Yayoi Kusama and Katsushika Hokusai, dotted infinity, Sony A7S III, 24mm G Master, Kodak Portra 800, (performative reality:1.4)"
"Mecha-centaur, fusion cannon haunches, targeting optics, neo-mythic battlefield, by Frank Frazetta and Hajime Sorayama, chrome dynamism, ARRI Alexa Mini LF, Panavision Ultra Panatar, Kodak 5219, (hybrid warfare:1.5)"
"Cyberspace yakuza, neural tattoos, datajack knuckles, virtual reality onsen, artwork by Takashi Murakami and William Gibson, neon noir, Blackmagic URSA Mini Pro 12K, Zeiss Supreme Prime, Vision3 250D, (digital underworld:1.3)"
"Quantum sumo wrestler, probability field dohyo, superposition mawashi, 5D tournament, in style of Botero meets Escher, gravitational distortion, Canon C70, Sumire Primes, Fujifilm Pro 400H, (massive physics:1.4)"
"Nanotech koi, data stream scales, binary pond ripples, silicon garden, art by Yayoi Kusama and Katsuya Terada, pixelated impressionism, Hasselblad 907X, XCD 65mm, CineStill 50D, (digital serenity:1.5)"
"Chronoshift samurai, temporal katana, era-shifting armor, anachronistic Edo, by Yoshitaka Amano and Syd Mead, retrofuturistic ukiyo-e, Leica M11, 50mm APO-Summicron, JCH StreetPan 400, (time-sliced tradition:1.3)"
"Psyborg monk, neural rosary, quantum prayer wheel, virtual reality monastery, artwork by Alex Grey and Zdzis?aw Beksi?ski, transcendental horror, RED Monstro 8K VV, Leitz Thalia, Kodak Vision3 500T, (digital enlightenment:1.4)"
"Holographic oni, light construct kanabo, pixel yokai horde, neo-Tokyo hell realm, in style of Junji Ito meets Tron, glitch horror, Sony FX9, Venice Rialto extension, Fujifilm Eterna 250D, (demonic bandwidth:1.5)"
"Quantum kabuki, superposition stage, entangled props, 5D theater, art by teamLab and Katsushika Hokusai, interactive ukiyo-e, Phantom Flex4K, Caldwell Chameleon, Kodak Vision3 200T, (performative multiverse:1.3)"
"Mecha-kappa, hydraulic shell, plasma cucumber, cybernetic river, by Hayao Miyazaki and Simon St?lenhag, eco-punk, ARRI Alexa 65, DNA Lenses, Fujifilm Eterna 500T, (folkloric futurism:1.4)"
"Nanoforge swordsmith, quantum-edge katana, probability alloy, orbital dojo, artwork by Yoji Shinkawa and Zaha Hadid, neo-brutalist, Blackmagic URSA Mini Pro G2, Atlas Orion Anamorphics, Lomography Color Negative 800, (cosmic craftsmanship:1.5)"
"Chrono-geisha, temporal kimono, era-shifting kanzashi, anachronistic teahouse, in style of Alphonse Mucha meets Blade Runner, art nouveau cyberpunk, Leica SL2-S, Summilux-SL 50mm, Cinestill 800T, (timeless future:1.3)"
"Biopunk sumo, engineered muscles, DNA-infused mawashi, CRISPR dohyo, art by Hajime Sorayama and Francis Bacon, chrome distortion, Canon EOS C500 Mark II, Sumire Primes, Kodak Portra 400, (genetic competition:1.4)"
"Quantum taiko drummer, probability wave rhythms, spacetime percussion, 5D festival, by teamLab and M.C. Escher, interactive impossibility, RED V-Raptor XL, Tokina Vista One T1, CineStill 50D, (resonant dimensions:1.5)"
"Holographic geisha,data stream kimono,quantum origami fan,virtual cherry blossoms,neo-Tokyo skyline,Ghost in the Shell aesthetics,Ilya Kuvshinov,volumetric lighting,motion capture particles,augmented reality overlays,Magic Leap One,computational photography,(digital elegance:1.4)"
"Dieselpunk Valkyrie,propeller wings,diesel-powered hammer,oil-stained armor,Valhalla airship hangar,Frank Frazetta,Ashley Wood,smoky atmosphere,high-speed sync flash,forced perspective,Fujifilm GFX 100S,tilt-shift lens,(mythic power:1.3)"
"Fractal fungi forest,self-replicating mushrooms,hyperbolic spore patterns,mycological network interfaces,Annihilation movie meets Matt Schuler art,bioluminescent lighting,microscopic textures,focus stacking,UV fluorescence,Canon MP-E 65mm macro,light painting technique,(organic complexity:1.5)"
"Quantum tarot reader,probability wave cards,entangled fate strings,Schrodinger's cat familiar,cosmic fortune-telling parlor,Salvador Dali,Android Jones,multiple exposure,crystal ball refraction,smoke effects,Lensbaby Velvet 85,lomography film,(mystical uncertainty:1.2)"
"Nanobot swarm sculptor,shaping liquid metal,emergent AI artwork,molecular assembly chamber,Ted Chiang short story visualization,Beeple,Daniel Dociu,electron microscope details,high-speed micro photography,laser light effects,Phantom Flex4K camera,probe lens,(artistic evolution:1.4)"
"Astral plane surfer,riding cosmic waves,nebula wetsuit,stardust wake,celestial beach backdrop,Roger Dean,Peter Mohrbacher,aura photography techniques,lens flares,long exposure star trails,Nikon D850,14-24mm f/2.8,IMAX film stock,(transcendent action:1.3)"
"Clockwork hummingbird,gear feathers,mainspring heart,nectar fuel cells,steampunk flower garden,John Avon,Seb McKinnon,frozen motion,extreme macro,tilt-shift selective focus,Olympus OM-D E-M1X,60mm f/2.8 macro,Polaroid Type 55,(delicate mechanism:1.5)"
"Psychic coral reef,telepathic fish schools,thought bubble seas,mind-reading anemones,underwater dreamscape,Christian Riese Lassen,Julie Dillon,submerged lighting,split-level photography,underwater housing,Sony A1,24-70mm f/2.8 GM,Magic Filter,(mental ecosystem:1.4)"
"Gravity-defying parkour,inverted cityscapes,Escher-inspired architecture,quantum levitation shoes,mind-bending urban playground,Rob Gonsalves,Jeremy Geddes,bullet-time array,extreme wide-angle,simulated zero-gravity,Red Komodo 6K,8-15mm fisheye,Kodak Vision3 500T,(physics-defying:1.3)"
"Chrono-synclastic infundibulum,time-twisted explorer,temporal fracture landscapes,parallel reality fragments,Kurt Vonnegut novel cover,John Harris,Dan Mumford,chronophotography,multiple exposure,time-slice technique,Sinar P3 large format,scanning back digital,cinemagraph elements,(timeless moment:1.5)"
"Photosynthetic cyborg,chloroplast circuitry,solar-powered exoskeleton,greenhouse metropolis,eco-futurism utopia,Moebius,Simon St?lenhag,infrared photography,false color palette,light painting,Phase One XT,150mm Blue Ring,Aerochrome simulation,(techno-organic:1.4)"
"Origami universe creator,folding spacetime,paper planet pleats,cosmic creases,Neil deGrasse Tyson fever dream,Robert McCall,James Gurney,miniature model photography,tilt-shift effect,paper texture lighting,Hasselblad 907X,90mm CF,large format scanning,(intricate cosmos:1.3)"
"Neuromancer netrunner,brainstem jack,data mohawk,neon tribal tattoos,cyberpunk favela,William Gibson book art,Josan Gonzalez,cyberdelic colors,double exposure,digital glitch effects,Sony FX3,35mm T1.5 cine lens,Blackmagic RAW,(high-tech low-life:1.5)"
"Quantum vampire hunter,probability stake,superposition crossbow,Schrodinger's garlic,Transylvanian hadron collider,Hellsing anime meets CERN,Yoshitaka Amano,hard lighting,UV blacklight effects,smoke machine atmosphere,Canon EOS C70,50-1000mm cine-servo,Kodak Double-X,(sci-fi gothic:1.4)"
"Biopunk tattoo artist,symbiotic ink,living needles,organic tattoo machine,evolving body art,H.R. Giger,Brandon Bauer,macro skin details,cross-polarized lighting,ultraviolet fluorescence,Fujifilm GFX 100,120mm macro,wet plate collodion,(living canvas:1.3)"
"Mecha-kaiju battle,nanotech Godzilla,quantum Mothra,Tokyo energy grid arena,Guillermo del Toro mech designs,Simon Lee concept art,dynamic composition,practical miniatures,motion control camera,atmospheric haze,ARRI Alexa 65,28mm Master Prime,70mm IMAX,(titanic clash:1.5)"
"Holographic street food vendor,volumetric ramen,photonic sushi,light-constructed food stall,cyberpunk night market,Syd Mead,Lap Pun Cheung,neon lighting,anamorphic lens flares,steam effects,Panasonic S1H,50mm f/0.95 Noctilux,CineStill 800T,(digital delicacies:1.4)"
"Lovecraftian space station,non-Euclidean architecture,cosmic horror airlocks,eldritch reactor core,Event Horizon meets 2001: A Space Odyssey,Wayne Barlowe,Zdzis?aw Beksi?ski,practical model work,forced perspective,atmospheric lighting,IMAX MSM 9802,40mm f/1.9 Hawk,Kodak Vision3 200T,(cosmic dread:1.3)"
"Quantum realm fairy,Planck scale wings,probability cloud dress,quark-gluon tiara,subatomic enchanted forest,Josephine Wall,Tomasz Alen Kopera,extreme macro,dark field microscopy,Schlieren imaging,Leica S3,Macro-Elmarit-S 120mm,Focus stacking,(miniature magic:1.5)"
"Cybernetic shaman,neural lace headdress,holographic spirit animals,techno-organic medicine wheel,digital peyote vision,Alex Grey,Android Jones,projection mapping,fractal animations,smoke machine effects,RED V-Raptor,8K VV,14mm Sigma Cine,Anamorphic Prism Lens Filters,(techno-mysticism:1.4)"
