"young eighties annie lennox as a zombie, 7 days to die zombie, fine art, award winning, intricate, elegant, sharp focus, cinematic lighting, highly detailed, digital painting, 8 k concept art, art by guweiz and z. w. gu, masterpiece, trending on artstation, 8 k"
"bauhaus architecture, intricate, elegant, highly detailed, centered, digital painting, artstation, concept art, smooth, sharp focus, illustration, artgerm, tomasz alen kopera, peter mohrbacher, donato giancola, joseph christian leyendecker, wlop, boris vallejo"
"full-body rococo and cyberpunk style neon statue of a young attractive portugues macho dotado e rico android sim roupa reclining con piroca dura, glowing white laser eyes, prince crown of blue gears, diamonds, swirling silver-colored silk fabric. futuristic elements. full-length view. space robots. human skulls. intricate artwork by caravaggio. Trending on artstation, octane render, cinematic lighting from the right, hyper realism, octane render, 8k, depth of field, 3D"
"alnaqua a hooded wise old man with a long white beard wearing a brown hooded tunic riding on top of a lion, the man riding is on the lion, the wise man is riding on top, majestic, epic digital art, cinematic, trending on artstation, superb detail 8 k, wide - angle, masterpiece"
"leonardo davinci and a plague doctor hosting a podcast, intricate, highly detailed, comic book and renaissance art style, 4 k, concept art, table with microphones"
"a professional photographic view picture of a square orange fruit ,photographic filter unreal engine 5 realistic hyperdetailed 8k ultradetail cinematic concept art volumetric lighting, fantasy artwork, very beautiful scenery, very realistic painting effect, hd, hdr, cinematic 4k wallpaper, 8k, ultra detailed, high resolution, artstation trending on artstation in the style of Albert Dros glowing rich colors powerful imagery"
"close - ip shot, character portrait, a seventeen years old male!! ravenclaw wizard with shoulders long black, slightly wavy hair, wearing browline!! glasses!!! with a potion bottle!!!, blue shiny lighting, beautiful fantasy art, film still, by artgerm and hayao miyazaki, by rutkowsky, trending on artstation"
"a man standing front of a huge door opening, foggy, concept art, 8 k detailed, wide lens"
"a gladiator in roman times, intricate, elegant, volumetric lighting, scenery, digital painting, highly detailed, artstation, sharp focus, illustration, concept art,ruan jia, steve mccurry"
"insanely detailed procedural render expressive dynamic fluid action scene of honey mycelium field spacesuit protects the dancing coolest girl from doom as the planet they orbit sends spores surround her, photorealism, sharp focus, award winning, tristan eaton, victo ngai,, maxfield parrish, artgerm, ryden, intricate details, portrait, bokeh"
"a psychedelic portrait of omin dran skeletal mind flayer psion goat skull politician, vibrant color scheme, highly detailed, in the style of romanticism, cinematic, artstation, moebius, greg rutkowski"
"spirit wolf by GEOGLYPHIKS by MICHAEL DIVINE and AMANDA SAGE in the style of oil painting visionary art, intricate oil painting artwork. , trending on artstation, very coherent symmetrical artwork, oil painting"
"werecreature consisting of a human and crocodile, photorealistic drawing, forest, trending on artstation"
"crying cat sitting on the sofa, ultra realistic, concept art, intricate details, highly detailed, photorealistic, octane render, 8 k"
"Portrait of Jesus Christ as a medieval knight in the style of Farcry cover, angry look, highly detailed, digital painting, Trending on artstation , HD quality, dramatic light, octane"
"lighthouse, ocean, two loons, crashing waves, light, black and white, tattoo art, dramatic lighting, illustration by Greg rutkowski, yoji shinkawa, 4k, digital art, concept art, trending on artstation"
"color light waves, color spectrum refraction in white space with white smoke,white androids, light through glass, cinematic lighting, intricate, elegant, super highly detailed, art station, concept art, Unreal Engine 5, Photorealism, HD quality, 8k resolution, cinema 4d, 3D, beautiful, art by artgerm and greg rutkowski and alphonse mucha and loish and WLOP"
"south indian woman doing squats, ultra realistic, concept art, intricate details, highly detailed, photorealistic, octane render, 8 k, unreal engine"
"a close - up of a gundam head, drawn by robbie trevino, poster, forty - five degree perspective composition, sketch, digital art, comic art, concept art"
"concept art of pikachu emitting thunder, highly detailed painting by dustin nguyen, akihiko yoshida, greg tocchini, greg rutkowski, cliff chiang, 4 k resolution, trending on artstation, 8 k"
"4 marbles on a table each containing a a different element ,1 with soil and plants, 1 with sea waves, 1 with a raging fire, 1 with a tornado , on a old piece of wood, hyper realistic, 4k, f1.8, boketh, depth of field, refraction, reflections on wood, photograph, glowing, glowing particles exiting the marble"
"portrait painting of a post - apocalyptic green haloed bald androgynous teenager with white eyes, ultra realistic, concept art, intricate details, eerie, highly detailed, photorealistic, octane render, 8 k, unreal engine. art by artgerm and greg rutkowski and charlie bowater and magali villeneuve and alphonse mucha"
"anonymous as a hippy, award winning creature portrait photography, extremely detailed, artstation, 8 k, sensual lighting, incredible art, wlop, artgerm"
"Dark Fantasy Painting of a muscular red beast face with saliva and drool dripping from its mouth, creepy, unsettling, horror, upper body, intricate, wild, highly detailed, digital painting, artstation, concept art, smooth, sharp focus, illustration, art by artgerm and greg rutkowski and alphonse mucha"
"character portrait of buff barbarian karl marx with a tattoo of an eye on the forehead, dungeons and dragons artwork, dynamic composition, dramatic lighting, trending on artstation, award winning art, stylized painting by leonardo da vinci, raphael and richard corben, concept art, 4 k, 8 k, gold and teal color scheme"
"magnificent view of the hanging gardens of babylon, intricate, elegant, volumetric lighting, digital painting, highly detailed, artstation, sharp focus, illustration, concept art, ruan jia, steve mccurry"
"female aquaman, au naturel, hyper detailed, digital art, trending in artstation, cinematic lighting, studio quality, smooth render, unreal engine 5 rendered, octane rendered"
"cowboy with a katana striking an action pose, old, white beard, wrinkles, handsome, action pose, katana, profile, intricate, detailed, volumetric lighting, scenery, digital painting, highly detailed, artstation, sharp focus, illustration, concept art, ruan jia, steve mccurry"
"azurite viking warrior, regal, elegant, winter, snow, beautiful, stunning, hd, illustration, epic, d & d, fantasy, intricate, elegant, highly detailed, wide angle, digital painting, artstation, concept art, smooth, sharp focus, illustration, wallpaper, art by artgerm and greg rutkowski and alphonse mucha and jin xiaodi"
"Portrait of Bernie Sanders piloting a battle mech, fantasy, intricate, highly detailed, digital painting, trending on artstation, sharp focus, illustration, style of Stanley Artgerm and Momo Koshu and Dan Mumford"
"portrait of a fat blue alien. big friendly smile. character concept art. science fiction illustration. close up of the face. key panel art graphic novel. detailed face, beautiful colour palette. digital painting"
"rpg! profile! portrait of humanoid bird on white background, beak, feathers, plague doctor, beautiful clothes, dark souls, bloodborne, intricate, highly detailed, digital painting, artstation, concept art, smooth, sharp focus, illustration, art by norman rockwell emiliano ponzi andrey remnev yoann lossel aaron jasinski, 8 k"
"a templar knight standing in a forest near a river at sunset, anatomically correct, hyperrealistic, concept art, octane render, unreal engine 5, trending on Artstation, high quality, 8K, highly detailed, symmetrical, five fingers, path tracing, soft lighting"
beautiful lifelike award winning marble statue bust of tsunku trending on art station artgerm greg rutkowski alphonse mucha museum quality cinematic atmospheric
"realistic jaguar holding black drinking can, by greg rutkowski, dc comic, todd mcfarlane, dynamic pose, intricate, futuristic, fantasy, elegant, by stanley artgerm lau, greg rutkowski, thomas kinkade, alphonse mucha, loish, norman rockwell"
"purple church and wet ground under night sky,anime background for half-length character,very detailed,trending on artstation, view from below"
"a mean looking cybernetic punkrock cheetah mutant, cyberpunk concept art by guweiz and josan gonzalez, digital art, highly detailed, intricate, sharp focus, trending on artstation hq, deviantart, pinterest, unreal engine 5, 4 k uhd image"
"a wise old troll inside a medieval hobbit house, ornate, beautiful, atmosphere, vibe, flowers, concept art illustration, color page, 4 k, tone mapping, doll, akihiko yoshida, james jean, andrei riabovitchev, marc simonetti, yoshitaka amano, digital illustration, greg rutowski, volumetric lighting, sunbeams, particles"
"symmetrical - face!! portrait of a fallout ghoul during world - war - one fighting in the trenches, red bright fire and thick black smoke in the background, horror, grim - lighting, high - contrast, intricate, elegant, highly detailed, centered, digital painting, artstation, concept art, smooth, sharp focus, illustration, artgerm, tomasz alen kopera, peter mohrbacher, donato giancola, joseph christian leyendecker, wlop, boris vallejo"
"the dying moon, dynamic lighting, photorealistic dark sci - fi concept art, trending on artstation, stunning visuals, creative, cinematic, ultra detailed"
"underground stree thug, man, grills, vitiligo, energetic, laughing, fit, warhammer, lord of the rings, sweaty, intricate, highly detailed, digital painting, artstation, concept art, smooth, sharp focus, illustration, unreal engine 5, 8 k, art by artgerm and greg rutkowski and alphonse mucha"
"concept art for a station wagon covered in mounted guns, painted by syd mead, high quality"
"A photo of Eldritch Nautilus with californium woman and ambre floating underwater at night,wireframe,transparency,glass,intricate light,intricate artwork masterpiece,golden ratio,trending on artstation,highly detailed,Art by John Chamberlain"
"image of a woman kissing a skull with dripping paint,love betwen living and death,hauntingly beautiful art,anime skull portrait woman,a beautiful artwork illustration,black and white artwork,the kiss,gothic art,highly detailed dark art"
"Cyanotype print of a beautifull woman. Prussian blue tones,distinctive coloration,high contrast,blueprint aesthetics,atmospheric mood,sun-exposed paper,silhouette effects,delicate details,historical charm,handmade and experimental quality"
"bust of a prince of darkness , long hairs, gradient black red, dreamy and ethereal, orange eyes, golden ratio, vicious expression, ornate frilly suit,cloudy ghostly aspect, beautiful, dark fantasy, intricate, elegant, rainbow bubbles, highly detailed, digital painting, artstation, concept art, smooth,b sharp focus, illustration, black background art by artgerm and greg rutkowski and alphonse mucha"
"An extremely psychedelic celestial undertaker in his black fedora hat, colorful, surreal, dramatic lighting, magic mushrooms, psilocybin, LSD, face, detailed, intricate, elegant, highly detailed, digital painting, artstation, concept art, smooth, sharp focus, illustration, art by Krenz Cushart and Artem Demura and alphonse mucha"
"venom as the nine tailed fox, kurama, dynamic lighting, photorealistic dark fantasy concept art, trending on art station, stunning visuals, creative, cinematic, ultra detailed"
"a large pirate ship in a dense jungle, misty background, light rays, beautiful lighting, vivid colors, intricate, elegant, smooth, sharp focus, highly detailed digital painting, concept art, cinematic, unreal engine, 4 k wallpaper, trending on cgsociety, trending on artstation"
"a simple concept art portrait of a predatory alien species, an award winning yoshitaka amano digital art, by, james gurney and gerhard richter. art by takato yamamoto. masterpiece, deep colours"
"portrait of young pete burns from the eighties, with long curly hair as a zombie with cuts on his face, dead or alive, 7 days to die zombie, fine art, award winning, intricate, elegant, sharp focus, cinematic lighting, highly detailed, digital painting, 8 k concept art, art by guweiz and z. w. gu, masterpiece, trending on artstation, 8 k"
"undead armoured soldiers in burned forest full of smoke and ashes, fantasy style, highly detailed, smooth, sharp focus, portrait, concept art, intricate details, fantasy poster, dark athmosphere, 8 k. lifelike. nikon d 8 5 0"
"A grayscale illustration of a woman done in a style reminiscent of classic 1950s pin-up art. She exudes a sense of confidence and allure, with her hair styled in an elaborate vintage updo featuring curls and waves that suggest both elegance and playfulness. The artistic quality of the drawing emphasizes detail and contrast, utilizing shading techniques to create depth and texture, particularly noticeable in the elaborate hairstyle and expressive features"
"full body concept art of Jack Torrance wearing viking armor made with porcelain by Jeff Easley and Peter Elson + beautiful eyes, beautiful face + symmetry face + galaxy + gothic, surreal, dread + highly detailed, intricate complexity, epic composition, magical atmosphere + masterpiece, award winning + trending on artstation"
"closeup portrait shot of a western cowboy in a scenic western environment, intricate, elegant, highly detailed, centered, digital painting, artstation, concept art, smooth, sharp focus, illustration, artgerm, tomasz alen kopera, peter mohrbacher, donato giancola, joseph christian leyendecker, wlop, boris vallejo"
"octane render of a pink anthropomorphic frog wearing a golden set of armor sitting in a desk at an office, very intricate, very detailed, trending on artstation"
"c 3 - p 0 with red eyes, rule of thirds, beautiful detailed face, ultra realistic, concept art, intricate details, serious, highly detailed, photorealistic, octane render, 8 k, unreal engine, detailed oil painting, zdzisław beksinski"
"emo jester anime girl, in neo tokyo hong kong, kawaii decora rainbowcore, vhs monster high, glitchcore witchcore, barcodes checkered spiked hair, pixiv, a mage witch hacker hologram by penny patricia poppycock, pixabay contest winner, holography, irridescent, photoillustration, maximalist maximalism vaporwave, by gerhard munthe, 4 k resolution, nier : automata inspired, bravely default inspired, vibrant but dreary but upflifting red, black and white color scheme!!! ( ( space nebula background ) ) emo demonic horrorcore japanese yokai doll, low quality sharpened graphics, remastered chromatic aberration spiked korean bloodmoon sigil stars draincore, gothic demon hellfire hexed witchcore aesthetic, dark vhs gothic hearts, neon glyphs spiked with red maroon glitter breakcore art"
"life of a forgotten disney character, scene features a disney character, by zdzislaw beksinski, by dariusz zawadzki, by wayne barlowe, gothic, surrealism, cosmic horror, lovecraftian, cold hue's, warm tone gradient background, concept art, beautiful composition"
"venom as deadpool, dynamic lighting, photorealistic fantasy concept art, trending on art station, stunning visuals, creative, cinematic"
"A man!!!!!-squid-shark crossbreed, illustrated by Antoine Verney-Carron and J. Lesaffre, trending on artstation, 4k, 8k, artstation 3d render, artstation 3d, artstation graphics, artstation lighting"
"portrait of a rotten tree spirit dryad with a beautiful face and flaming mouth and eyes, intricate, headshot, mushrooms, fungi, lichen, sketch lines, graphite texture, old parchment, guillermo del toro concept art, justin gerard monsters, intricate ink illustration, artstation"
"Orc looking into the camera, leather fur jacket, eyes open, full body shot, detailed face, orc, portrait, artstation, realistic, highly detailed, symmetrical, D&D, Dungeons & Dragons, hyper realistic, dynamic pose, high detail, octane render, unreal engine, 8k, fantasy art, highly detailed, dramatic lighting, concept art"
"close-up macro portrait of the face of a beautiful princess with animal skull mask, epic angle and pose ribcage skeleton, symmetrical artwork, 3d with depth of field, blurred background, cybernetic jellyfish female face skull phoenix bird, translucent, nautilus, energy flows of water and fire. a highly detailed epic cinematic concept art CG render. made in Maya, Blender and Photoshop, octane render, excellent composition, cinematic dystopian brutalist atmosphere, dynamic dramatic cinematic lighting, aesthetic, very inspirational, arthouse. y Greg Rutkowski, Ilya Kuvshinov, WLOP, Stanley Artgerm Lau, Ruan Jia and Fenghua Zhong"
"a medieval hobbit home, ornate, beautiful, atmosphere, vibe, mist, smoke, chimney, rain, well, jungle, wet, pristine, puddles, waterfall, clear stream, bridge, orange, green, stained glass, forest, flowers, concept art illustration, color page, 4 k, tone mapping, doll, akihiko yoshida, james jean, andrei riabovitchev, marc simonetti, yoshitaka amano, digital illustration, greg rutowski, volumetric lighting, sunbeams, particles, rembrandt"
"moon knight mixed with saints row, rpg reference, art by greg rutkowski, artgerm, trending on artstation, octane render, insanely detailed, 8 k, hd"
"portrait Daft Punk steampunk cute-fine-face, pretty face, realistic shaded Perfect face, fine details. Anime. Bioshock steampunk realistic shaded lighting by katsuhiro otomo ghost-in-the-shell, magali villeneuve, artgerm, rutkowski Jeremy Lipkin and Giuseppe Dangelico Pino and Michael Garmash and Rob Rey"
"а fantasy Proto-Slavic warrior inspired a game For Honor, full body, detailed and realistic, 4k, trending on artstation, octane render"
"female alien, tubular creature, blood vesels, no face, dystopian surrealism, artstyle alex ries and zdzisław beksinski, symmetry accurate features, very intricate details, high resolution, 4 k, naraka buddhist demon korean female, highly detailed, symmetrical long head, smooth marble surfaces, detailed ink illustration, raiden metal gear, cinematic smooth stone, deep aesthetic, concept art, post process, carved marble texture and silk cloth, latex skin, highly ornate intricate details, in the style of 8 8 grzes"
"an anchor in the sand near a coral reef surrounded by sea creatures, concept art, highly detailed, high quality, bright colors"
"a highly detailed fine art painting of multiple british members of parliament in the house of commons wearing clown costumes with pleasant joyful face masks, they are smoking. in the style of edward hopper, richard hamilton. concept art. whimsical. green leather benches. colour graded by rembrandt. sharp oil painting. photographic qualities. no artefacts, minimal noise. desaturated. faces must be clear and not creepy. 8 k"
"duck as a realistic fantasy knight, closeup portrait art by donato giancola and greg rutkowski, realistic face, digital art, trending on artstation, symmetry!!, skull helmet"
"symmetry!! portrait of grotesque alien, sci - fi, glowing lights!!, horror, intricate, elegant, dark design, highly detailed, dark lighting, digital art, digital painting, artstation, smooth, sharp focus, illustration, art by artgerm and h r giger and greg rutkowski and alphonse mucha, 8 k"
"portrait of medical paramedic gorilla tech wear,boxcutter detailed hard surface modelling, greebles,wires,gadgets,cables,lenses,gears,led displays,UI intricate, elegant, highly detailed, digital painting, artstation, concept art, smooth, sharp focus, illustration, art by artgerm and greg rutkowski and alphonse mucha"
"modern futuristic minimalist house designed by giger, perfect composition, beautiful detailed intricate insanely detailed octane render trending on artstation, 8 k artistic photography, photorealistic concept art, soft natural volumetric cinematic perfect light, chiaroscuro, award - winning photograph, masterpiece, oil on canvas, raphael, caravaggio, greg rutkowski, beeple, beksinski, giger"
"An anthropomorphic!!!!! shark, illustrated by Antoine Verney-Carron and J. Lesaffre, trending on artstation, 4k, 8k, artstation 3d render, artstation 3d, artstation graphics, artstation lighting"
"concept art by greg rutkowski, a very tall, and slender woman with blond hair, sitting with the crew in the ship's flight deck, brutalist futuristic interior, dark lighting atmosphere, detailed portraits, nostalgic atmosphere, scifi, digital painting, artstation, concept art, smooth, sharp foccus ilustration, artstation hq"
"portrait of an overweight cyberpunk barkeeper, robotic arms, ratz, neuromancer, bar background, painted by greg rutkowski, painted by igor kieryluk, high detail, dramatic light, digital art, trending on artstation"
"A portrait of Rosie the Riveter, final fantasy, digital painting, portrait , cinematic lighting, highly detailed, artstation, concept art, illustration, smooth, sharp focus, artgerm , greg rutkowski, alphonse mucha, editor's pickup, trending on artstation, trending on deviantart, wlop, 8k"
"a hooded adventurer standing in a dungeon. atmospheric lighting, 8 k. by makoto shinkai, stanley artgerm lau, wlop, rossdraws, james jean, andrei riabovitchev, marc simonetti, krenz cushart, sakimichan, d & d trending on artstation, digital art"
"illustration of Syd Barrett, the founding member of Pink Floyd,  surrounded by a psychedelic swirl of colors, with a subtle gradient  effect, highly detailed, 4k, anime-inspired style, with intricate  details and textures"
"a close up of a person's face on a cracked surface,inspired by Alberto Seveso,featured on zbrush central,portrait of an android,fractal human silhouette,realistic 3 d render,subject made of cracked skin,woman,made of lava"
"illustration of astral nomads riding (starlight:1.5) horses through  swirling vortexes of color and light, nebulae, stardust, cosmic energy,  highly detailed, 4K, realistic"
"A white tiger is diving below the watersurface down into the water,splash of water above the surface,bubles of air,on the left a turtle,on the ground colored coral environment"
"1girl,mysterious  girl,(with freckles:0.2),an exotic girl in off-shoulder sweater,fading  backlit background,pastel colors,alluring goddess,amazing depth,surreal,geometric patterns,intricately detailed,bokeh,perfect  balanced,deep fine borders,artistic photorealism,smooth"
"breathtaking surreal painting of a muscular cave man emerging from a (misty:1.0) forest, surrounded by giant stone statues with (glowing:1.5) eyes, cityscape in the background with buildings made of obsidian, atmospheric lighting, warm tone, highly detailed, 8k, iridescent accents . award-winning, professional, highly detailed"
"surreal illustration of a primitive cave man standing in front of a (dreamlike:1.2) portal to another dimension, with swirling clouds and (glowing:1.5) orbs floating above him, surrounded by ancient symbols etched into the stone walls, highly detailed, 8k, vibrant colors"
"concept art punk woman riding a xuer future motorcycle,at night,neon in the city,fast speed motion,motion blur,bokeh . digital artwork, illustrative, painterly, matte painting, highly detailed"
"digital art of a concept car,irradiated and warped by green electric arc,(translucent:1.3),fog atmosphere,black background,traveled by lightning"
"digital art of a translucent plastic woman,(translucent:1.5),irradiated and warped by green electric arc,fog atmosphere,black background,traveled by lightning"
"digital art of a translucent plastic woman posing,(translucent:1.5),irradiated and warped by green electric arc,fog atmosphere,scientist lab background,traveled by lightning,windows sunlight"
"AI-generated artwork,generative art,creative coding,digital painting,computer-generated imagery,artistic algorithms,neural networks,machine learning,data analysis,research facilities,high-tech gadgets,AI-powered robots,intelligent systems,cognitive computing,autonomous vehicles,self-driving cars,smart homes,internet of things,IoT,AI in action,technological advancements,futuristic concepts"
"digital art of a fisherman,lake,cristal clear water,beautiful trees,beautiful flowers,blue light,romanticism art,(landscape art stylized by Karol Bak:1.3),Paul Gauguin,Cyberpop,short lighting,F/1.8,extremely beautiful,<lora:oil-painting:2>,oil painting of"
"photography of a stunning woman holding a (pretty pony:1.2) with vibrant pink and white color scheme, whimsical fairy tale atmosphere, soft focus, shallow depth of field, dreamy lighting, high resolution, 8k"
"Rock 'n' Roll inspired digital art of a cat band (Mewvelous Musicians) performing live with energetic stage presence,bold lighting,and dynamic poses,vibrant colors,sharp lines,high-quality artwork"
"Create a visually stunning octopus ice cream sundae,served on an elegant plate. The sundae features scoops of orange ice cream with realistic,varied shades of brown,and (garnished with rolled up tentacle pieces:3). Top it with whipped cream and drizzle with chocolate sauce,sprinkled with a variety of nuts. Ensure the background is a warm,indoor setting with soft,natural light filtering through,creating a cozy,inviting atmosphere. The composition should be well-lit,highlighting the textures and colors of the ice cream and tentacles,making it look delicious and visually intriguing.,sharp focus,hyperdetailed photography,masterpiece,best quality,high quality,highres,ultra-detailed,best quality,8K,high resolution,extreme detail,(outstanding composition:1.4)"
