"close-up,a super cute hungry little ((space alien)) bathing in cereal bowl with suds,large cereal box (((masterpiece))),(best quality),((ultra-detailed)),beautiful eyes,macro shot,colorful details,natural lighting,amazing composition,subsurface scattering,sss,vellus hairs++,amazing textures,filmic,soft light,OverallDetailXL,TheWeirdies"
"Chris Van Allsburg,Anton Fadeev,W. Heath Robinson,Esao Andrews,György Kepes"
"woman style by,Anton Fadeev,W. Heath Robinson,Esao Andrews"
"woman style by,Anton Fadeev,Franck Tacito,Tomek Setowski"
"digital art punk-rock Style of a girl,crooked smile,riding a motorcycle drives very fast,motion_blur,motion_lines,speed_lines,nude under an open leather jacket,in the street of paris at night,effeil tower,fog atmosphere,colorful,Tomek Setowski"
"CG artwork of a woman on a motorcycle with a giant blue monster hot on her heels,city streets at night,neon lights reflecting off the wet road,dark skies with stars visible,high-speed chase,dynamic composition"
"8 0 s art deco cyborg as aeon flux profile picture, rain like a dream, oil painting, cinematic, symmetrical, surreal, overgrown, dramatic, dreamlike, orchids, bold, cyberpunk, basquiat + zdzisław beksinski + james jean + loish + artgerm + rutkowski + moebius + francis bacon + gustav klimt"
"Art Nouveau style painting of a Starship in a docking bay by greg rutkowski and thomas kinkade, Trending on artstation, teal and orange color scheme"
"african biopunk alchemist, science fiction, highly detailed, digital painting, beautiful eyes, symmetry, concept art, sharp focus, illustration, global illumination, radiant light, detailed and intricate environment, art by artgerm and greg rutkowski and magali villeneuve and ilya kuvshinov"
"hyperrealistic mixed media painting of a victoria secret model skull woman with rainbow hair, stitched together, soft eyes and narrow chin, dainty figure, long hair straight down, combat boots, wet t shirt, wet, raining, dim volumetric lighting, 8 k octane beautifully detailed render, post - processing, portrait, extremely hyper - detailed, intricate, epic composition, cinematic lighting, masterpiece, trending on artstation, very very detailed, masterpiece, stunning"
"portrait of a white hair white eye knight, dramatic lighting, illustration by Greg rutkowski, yoji shinkawa, 4k, digital art, concept art, trending on artstation"
"female tennis player trying to hit huge tennis balls, Gloomhaven, matte painting concept art, art nouveau, beautifully backlit, swirly vibrant color lines, fantastically gaudy, aesthetic octane render, 8K HD Resolution"
"a closeup portrait of a young vivian leigh, 1 9 2 0 s city background, gorgeous view, sunset, film noir, depth, by seb mckinnon, by greg rutkowski, by igor kieryluk, digital art, trending on artstation"
"Lionel Messi as a viking, riding a majestic horse, D&D, fantasy, intricate, elegant, highly detailed, digital painting, artstation, concept art, matte, sharp focus, illustration, art by Artgerm and Greg Rutkowski and Alphonse Mucha"
"anime girl crying with tears on all of her face, rainy day, urban setting at night, highly detailed, trending on Artstation, Unreal Engine 4k, cinematic wallpaper by Stanley Artgerm Lau, WLOP, Rossdraws, James Jean, Andrei Riabovitchev, Marc Simonetti, and Sakimichan"
"award winning beautiful portrait commission of a male furry anthro albino puma fursona with a tail and a cute beautiful attractive detailed furry face wearing stylish black and pink cyberpunk clothes in a cyberpunk city at night while it rains. Character design by charlie bowater, ross tran, artgerm, and makoto shinkai, detailed, inked, western comic book art"
"trapped in my conscious, utopian galaxy, plasma, inrecately detailed, sky falling, look me inside of my eyes, transparent thermal being, thermal, bioluminiscent creatures, intricate artwork by beeple. octane render, trending on artstation, greg rutkowski very coherent symmetrical artwork. cinematic, hyper realism, high detail, octane render, 8 k"
"biblical cyborg girl, glowing veins subsurface scattering, deep sea of planet jupiter, underwater photography, by gerald brom, by mikhail vrubel, by peter elson, muted colors, extreme detail, trending on artstation, 8 k"
"concept art for the final act of the universe seconds before it unites into the holy fire of perfect love!! final victory of order over disorder!! final defeat of entropy! digital painting, artstation, smooth, sharp focus"
"Interplanetary wild west snake oil bull run serum cathedral, fantasy, portrait, sharp focus, intricate, elegant, digital painting, artstation, matte, highly detailed, concept art, illustration, volumetric lighting, purple green color scheme, art by Ilya Kuvshinov, artgerm"
"portrait of Aruula in a post apocalyptic city overgrown with lush vegetation, by Luis Royo, by Greg Rutkowski, dark, gritty, intricate, highly detailed face, backlit, strong rimlight, cover illustration, concept art, volumetric lighting, volumetric atmosphere,sharp focus, octane render, trending on artstation, 8k"
"professional photography, In a dimly lit jazz club, the woman reclines on a crimson velvet banquette, her knees drawn up and stiletto heels hooked over the armrests, a slender glass of champagne balanced on her full hip as she listens intently to the soulful crooning of the band, her eyes half-lidded with sultry anticipation"
"a stylish glass of red wine stylized as a delicate goth woman bust made of grapes and despair,tears dropping in the glass,style of Luis Royo"
"cinematic still,green neon silver tricycle inspired by alien technology,fractal design,glowing skull headlight,dystopian night city background,neon lights,wet streets,analog film,bokeh,professional,4k,highly detailed,cyborg,biomechanical,futuristic,bone structure,by ernst haeckel,dvr-cl-dvsn"
"A close-up of a man's face with a noose around his neck in a dimly lit Spanish prison cell,high-resolution photo with extreme detail,dramatic lighting,dark and gritty atmosphere,realistic,highly detailed,sharp focus,atmospheric,8k resolution,window lightning"
"Grunge style a sailing ship,in a lagoon,cristal clear water,fisherman's hut on ground,sunset,fog atmosphere,blue light,colorful,romanticism art,(landscape art stylized by Karol Bak:1.3),short lighting,F/1.8,extremely beautiful,distressed,vintage,dirty,noisy,flowers,trees"
"illustration of a gentle giant lizard,scales shimmering like opals,surrounded by iridescent butterflies,misty forest atmosphere,whimsical,dreamlike quality"
"luxury advertisement, a highly detailed epic cinematic concept art CG render digital painting artwork of an elderly professor in a grey coat with a long yellow scarf preaching for the revolution to start. By Greg Rutkowski, Ilya Kuvshinov, WLOP, Stanley Artgerm Lau, Ruan Jia and Fenghua Zhong, trending on ArtStation, made in Maya, Blender and Photoshop, octane render, excellent composition, cinematic dystopian soviet atmosphere, dynamic dramatic cinematic lighting, aesthetic, very inspirational, arthouse"
"symmetry!! mysterious cube floating, glowing lights!! intricate elegant, highly detailed, digital painting, artstation, concept art, smooth, sharp focus, illustration, art by artgerm and greg rutkowski and alphonse mucha"
award - winning masterpiece. artwork in the theme of pizza. trending on artstation. by salvador dali
"mario in space eating ramen, trending on artstation, ultra realistic, ultra detailed, digital painting"
"a full body portrait of a beautiful post apocalyptic offworld desert bedouin thief savage rogue in ballet pose by the emerald oasis pools, intricate, elegant, highly detailed, digital painting, artstation, concept art, smooth, sharp focus, illustration, art by krenz cushart and artem demura and alphonse mucha"
"hatsune miku and cinnamoroll, dance, intricate, elegant, highly detailed, digital painting, artstation, concept art, smooth, sharp focus, illustration, art by artgerm and greg rutkowski and alphonse mucha and william - adolphe bouguereau"
"a creepy clown waiting in the dark, concept art, shadows, painting, highly detailed"
"a beautiful classy drinking couple, dimly lit upscale 1920s speakeasy, relaxed pose, art deco, detailed painterly digital art style by Coles Phillips, retro vibe, 🍸, 8k octane beautifully detailed render, post-processing, extremely hyperdetailed, intricate, epic composition, grim yet sparkling atmosphere, cinematic lighting + masterpiece, trending on artstation, very detailed, vibrant colors, Art Nouveau, masterpiece"
"full body of a beautiful lisa edelstein high school girl, brown hair, ponytail, white ribbon, green eyes, full perfect face, western, fantasy, intricate, elegant, highly detailed, digital painting, artstation, detailed school background, matte, sharp focus, illustration, art by artgerm, greg rutkowski, alphonse mucha, sasoura, satchely, no distorsion"
"master chief from halo, realistic, unreal, highly detailed, 8 k, trending artstation, concept art, sharp focus"
"pikachu surfing on a wave made of green slime, pokemon tcg image, trending on artstation"
"don bluth, loish, artgerm, joshua middleton, steampunk, clockpunk anthropomorphic cheetah, wearing a track suit, smiling, symmetrical eyes symmetrical face, colorful animation forest background"
"anthropomorphic complex quadrilateral brain in edgy darkiron archaeopteryx, intricate, elegant, highly detailed animal monster, digital painting, artstation, concept art, smooth, sharp focus, illustration, art by artgerm, dwayne barlowe, trending on artstation and greg rutkowski and alphonse mucha, 8 k"
"a male teenager with long blue hair and yellow eyes wearing a winter overcoat, hyperrealistic, concept art, octane render, unreal engine 5, trending on artstation, high quality, 8 k, highly detailed, digital art, anatomically correct, symmetrical, realistic and defined face, high coherence, path traced, face portrait, yellow eyes, blue hair"
"imaan hammam, passionate, dancer, lord of the rings, expressive, charismatic, sweaty, intricate fashion clothing, insane, intricate, highly detailed, digital painting, artstation, concept art, surrealistic, smooth, sharp focus, illustration, unreal engine 5, 8 k, art by artgerm and greg rutkowski and alphonse mucha"
"cinematic still Gratticosm,GAN (Generative Adversarial Network),superfluid helium,quantum teleportation . emotional,harmonious,vignette,4k epic detailed,shot on kodak,35mm photo,sharp focus,high budget,cinemascope,moody,epic,gorgeous,film grain,grainy"
"Large spaceship hovering over a futuristic city, science fiction, dramatic angle, complex buildings, atmospheric, sunset,"
"Highly detailed 8k cinematic photorealistic render, dramatic lighting,  cinematic"
"abstract, motion blur, warm color palette, male figure, red yellow dominant colors, surreal effect, multiple exposures, ghosting image, contemporary portrait, overlapping visual elements, gradient, soft focus"
"2B by David Bailey, Jean-Baptiste Monge, Otto Piene, Andrew Ferez, Januz Miralles"
"ultra detailed, beautiful female android, deity, side portrait, sharp focus, highly detailed vfx portrait, scribble art, speed painting, geometric shapes, global illumination, by james jean and moebius!! and artgerm and liam brazier and victo ngai and tristan eaton. detailed, vector art, digital illustration, concept art. 8 k, hdr"
"A magic book owned by a flying wizard, highly detailed, intricate gold fibers, sharp focus, fantasy art by Artgerm and Greg Rutkowski and WLOP"
"A highly detailed, beautiful rendered, close up portrait of a mutant female boxer, half lizzard, half human, in spandex suit, with scars, high tech equipement attached to her body, in a tropical dystopic city in front of a garage, dried palmtrees, thick dust and red tones, bladerunner, cyberpunk, lost city, hyper-realistic environment, Epic concept art. Warhammer 40k"
"photorealistic painting art by midjourney and greg rutkowski,portrait of anonymous wearing a mysterious gas mask,high detail,cinematic lighting,moody atmosphere,8k,dramatic shadows,intricate details,film grain,dynamic pose,bold colors,surreal background,artistic style similar to Zdzislaw Beksinski"
"photography of anonymous wearing a unique gas mask, artistic photography style inspired by Stanislav Szukalski, high contrast, dramatic lighting, shallow depth of field, cinematic atmosphere, 4k, beautiful composition, detailed background, surreal, mysterious, hyperrealistic, octane render, dynamic angle"
"astronaut underwater putting a flag in the sand of the bottom of the ocean. there is a futuristic submarine in the background. dark, concept art, cinematic, dramatic, atmospheric, 8 k, trending on artstation, low visibility, zack snyder"
"A highly detailed, beautiful rendered, close up portrait of a mutant female boxer, half lizzard, half human, in spandex suit, with scars, high tech equipement attached to her body, in a tropical dystopic city in front of a garage, dried palmtrees, thick dust and red tones, bladerunner, cyberpunk, lost city, hyper-realistic environment, Epic concept art. Warhammer 40k"
"a painting of a African girl by Leonardo da Vinci . dramatic angle, ethereal lights, details, smooth, sharp focus, illustration, realistic, cinematic, artstation, award winning, rgb , unreal engine, octane render, cinematic light, macro, depth of field, blur, red light and clouds from the back, highly detailed epic cinematic concept art CG render made in Maya, Blender and Photoshop, octane render, excellent composition, dynamic dramatic cinematic lighting, aesthetic, very inspirational, arthouse"
"award winning beautiful portrait commission art of a male furry anthro albino wolf fursona with a tail and a cute beautiful attractive detailed furry face wearing black stylish cyberpunk pants and boots in a cyberpunk city at night while it rains. Character design by charlie bowater, ross tran, artgerm, and makoto shinkai, detailed, inked, western comic book art"
"west highland white terrier sitting by a pool, bright, reflections, intricate, sharp focus, lens flare, bloom, illustration, highly detailed, digital painting, concept art, matte, art by ruan jia and wlop and greg rutkowski, masterpiece"
"a roman emperor walking through a roman city, glorious, epic scene, beautiful, pools, in the style of artgerm, gerald brom, atey ghailan and mike mignola, vibrant colors and hard shadows and strong rim light, plain background, comic cover art, trending on artstation"
"an anthropomorphic beautiful male wizard portrait made of demon wearing robe, fine art, award winning, intricate, elegant, sharp focus, octane render, hyperrealistic, cinematic lighting, highly detailed, digital painting, 8 k concept art, art by jamie hewlett and z. w. gu, masterpiece, trending on artstation, 8 k"
"highly detailed ilustration of a mater from cars as a human being, intricate, elegant, highly detailed, digital painting, artstation, concept art, matte, sharp focus, illustration, hearthstone, art by artgerm"
"cirilla wearing tight in chest shirt!, half - opened shirt!!, ultra realistic, pretty face, extremely detailed face!!, anatomically correct!!, symmetrical!!!, concept art, apocalyptic, horror, close up, heavy grain, intricate details, highly detailed, photorealistic, octane render, 8 k, unreal engine. art by artgerm and greg rutkowski and alphonse mucha"
"plasticy kawaii portrait of a silly bashful squishy scifi saliva skeksis witch looks like mitch mcconnell, painfully adorable, soft bioluminescent membranes, gushy gills and baleen, translucent skin shows cute skeletal details in front of inky black background, friendly, occult, gelatinous with wittle tiny teeth, artgerm"
"intimidating cottagecore satanic demon warrior, muscular, dangerous, concept art, concept charakter"
"helmet of a forgotten deity made of soft translucent wax, wooden art nouveau swirls, strong subsurface scattering, colored smoke, gold cables, subsurface scattering, in the style of ruan jia and and beeple and giger, subsurface scattering, mystical colors, back light, rim light, dramatic lighting, 8 k, stunning scene, raytracing, octane render, trending on artstation"
"anthropomorphic beer berserker, intricate, elegant, highly detailed animal monster, digital painting, artstation, concept art, smooth, sharp focus, illustration, art by artgerm and greg rutkowski and alphonse mucha, 8 k"
"a painting of a very ordinary person, by Antoni Tàpies and Anselm Kiefer, ripped Hessian fabric, rusted metal, iron cladding, decay, mixed media, textured, anatomically correct, beautiful perfect face, sharp focus, Highly Detailed"
"Pirates vs Aliens, fantasy art by Greg Rutkowski"
"white robed cultist with a floating bird skull as head, detailed, comic book texture, 4 k asymmetrical portrait, frank miller, jamie hewlet, ashley wood, tom lovell, mike mignola, trending on artstation, norman saunders, will eisner, 4 k"
"a beautiful digital illustration painting of a detailed gothic fantasy cow in a bedroom, by benoit b. mandelbrot, steven belledin, martin johnson heade, lee madgwick, caspar david friedrich, and david rios ferreira. 8 k resolution trending on artstation concept art digital illustration"
"Portrait of pee-wee herman leaping to the side, highly detailed, digital painting, artstation, concept art, illustration, dramatic lighting, art by donato giancola"
"young angry woman, beautiful girl, full body, explosive hair, cowboy hat, realistic, serov, surikov, vasnetsov, repin, kramskoi, insanely detailed, charlie bowater, tom bagshaw, high resolution, octane rendered, unreal engine, illustration, trending on artstation, masterpiece, 8 k"
"a portrait of a hanged putin magician in glass armor releasing spell, full height, moving forward, cyberpunk concept art, trending on artstation, highly detailed, intricate, sharp focus, digital art, 8 k"
"cinematic portrait of a god droid, only head and chest, intricate, desaturated, Tim Hildebrandt, Wayne Barlowe, Bruce Pennington, donato giancola, larry elmore, maxfield parrish, Moebius, Thomas Ehretsmann, oil on canvas, gouache painting, masterpiece, trending on artstation, cinematic composition, dramatic pose, volumetric lighting, sharp, details, hyper-detailed, HD, 4K, 8K"
"(medium full shot) of (captivating blue aquatic creature) with scaly skin, armored plates, webbed limbs, large eyes, finned tail, glowing veins, sea anemones, set in a bustling underwater city, with towering structures, vibrant marine life, advanced technology, serene light , at night, ,Masterpiece,best quality, raw photo, realistic, very aesthetic, theW3iRDi3Sv2"
"(medium full shot) of (ethereal purple aquatic creature) with bioluminescent skin, scaly hide, webbed limbs, antennae, ethereal fins, phosphorescent spots, pearl ornaments, set in a mystical glowing bay, with calm waters, luminous plants, hidden nooks, ethereal beauty, during twilight, ,Masterpiece,best quality, raw photo, realistic, very aesthetic, theW3iRDi3Sv2"
"robotic sci-fi dog in a field sniffing a flower while comets fly above him and he gets scared flowers field stars digital painting, artstation, concept art, soft light, hdri, smooth, sharp focus, illustration, fantasy, intricate, elegant, highly detailed, D&D, matte painting, in the style of Greg Rutkowski and Alphonse Mucha and artemisia, 8k, highly detailed, jurgens, rutkowski, bouguereau, pastoral, rustic, georgic"
"mtg character portrait of a brawny male leonin warrior african lion angel of justice, with fiery golden wings of flame, wearing shining armor, wielding a flaming sword and holding a large fiery shield, by peter mohrbacher, mark brooks, wadim kashin, greg rutkowski, larry elmore, esao andrews, george pemba, ernie barnes, trending on artstation"
full body concept art of a female pirate by Frank Wu
"beauty young space woman analysing in a hologram with alien artifacts, electrical case display, 80s Aliens tech, ultrarealistic, dramatic lighting, electrical details, high details, 4k, 8k, best, accurate, trending on artstation, artstation, photorealism, ultrarealistic, digital painting, style of Peter Mohrbacher and Boris Vallejo and Wayne barlowe"
"fierce medusa, sexy, fantasy character portrait, ultra realistic, cinematic, concept art, intricate details, art nouveau, highly detailed by greg rutkowski, gaston bussiere, craig mullins, simon bisley, arthur rackham"
"patagonian temperate forests. magellanic, mountainous area. rare flora, nothofagus, twisted and bent trees. windy environment, shrubs, rocky and poorly drained. succulent species, crowberries carpeting the ground. overcast, cloudy. september 1 2 th. patagonian chile and argentina. trending on artstation, deviantart, worth 1 0 0 0. by greg rutkowski. national geographic and inaturalist hd photographs"
"of a dark and smokey mountain with large strange cute friendly volcanic creatures made of lava with big eyes, mouth and round teeth appearing from the ground, in the style of Gaudi, macro lens, shallow depth of field, highly detailed, digital painting, trending artstation, concept art, illustration, cinematic lighting, vibrant colors, photorealism, epic, octane render"
"a dying beached sea dragon washing up on the shore of a beach by jaime jones, cgsociety, fantasy art, concept art, artstation hd, deviantart hd. highly detailed. dramatic light. masterpiece"
